[
  {
    "module_slug": "social-research",
    "contest_slug": "pfki",
    "status": "ready",
    "card_visibility": "visible",
    "form_schema_id": "form.pfki.social-research.v1",
    "prompt_pack_id": "prompt.pfki.social-research.v1",
    "result_schema_id": "result.pfki.social-research.v1",
    "template_id": "template.pfki.social-research.v1",
    "criteria_pack_id": "criteria.pfki.social-research.v1",
    "example_pack_id": "example.pfki.social-research.v1",
    "faq_pack_id": "faq.pfki.social-research.v1",
    "source_policy_id": "sources.pfki.social-research.v1",
    "profile_version": "1.0.0"
  },
  {
    "module_slug": "legal-acts",
    "contest_slug": "pfki",
    "status": "ready",
    "card_visibility": "visible",
    "form_schema_id": "form.pfki.legal-acts.v1",
    "prompt_pack_id": "prompt.pfki.legal-acts.v1",
    "result_schema_id": "result.pfki.legal-acts.v1",
    "template_id": "template.pfki.legal-acts.v1",
    "criteria_pack_id": "criteria.pfki.legal-acts.v1",
    "example_pack_id": "example.pfki.legal-acts.v1",
    "faq_pack_id": "faq.pfki.legal-acts.v1",
    "source_policy_id": "sources.pfki.legal-acts.v1",
    "profile_version": "1.0.0"
  },
  {
    "module_slug": "salary",
    "contest_slug": "pfki",
    "status": "ready",
    "card_visibility": "visible",
    "form_schema_id": "form.pfki.salary.v1",
    "prompt_pack_id": "prompt.pfki.salary.v1",
    "result_schema_id": "result.pfki.salary.v1",
    "template_id": "template.pfki.salary.v1",
    "criteria_pack_id": "criteria.pfki.salary.v1",
    "example_pack_id": "example.pfki.salary.v1",
    "faq_pack_id": "faq.pfki.salary.v1",
    "source_policy_id": "sources.pfki.salary.v1",
    "profile_version": "1.0.0"
  },
  {
    "module_slug": "support-letter",
    "contest_slug": "pfki",
    "status": "ready",
    "card_visibility": "visible",
    "form_schema_id": "form.pfki.support-letter.v1",
    "prompt_pack_id": "prompt.pfki.support-letter.v1",
    "result_schema_id": "result.pfki.support-letter.v1",
    "template_id": "template.pfki.support-letter.v1",
    "criteria_pack_id": "criteria.pfki.support-letter.v1",
    "example_pack_id": "example.pfki.support-letter.v1",
    "faq_pack_id": "faq.pfki.support-letter.v1",
    "source_policy_id": "sources.pfki.support-letter.v1",
    "profile_version": "1.0.0"
  },
  {
    "module_slug": "presentation",
    "contest_slug": "pfki",
    "status": "ready",
    "card_visibility": "visible",
    "form_schema_id": "form.pfki.presentation.v1",
    "prompt_pack_id": "prompt.pfki.presentation.v1",
    "result_schema_id": "result.pfki.presentation.v1",
    "template_id": "template.pfki.presentation.v1",
    "criteria_pack_id": "criteria.pfki.presentation.v1",
    "example_pack_id": "example.pfki.presentation.v1",
    "faq_pack_id": "faq.pfki.presentation.v1",
    "source_policy_id": "sources.pfki.presentation.v1",
    "profile_version": "1.0.0"
  },
  {
    "module_slug": "scenario-plan",
    "contest_slug": "pfki",
    "status": "ready",
    "card_visibility": "visible",
    "form_schema_id": "form.pfki.scenario-plan.v1",
    "prompt_pack_id": "prompt.pfki.scenario-plan.v1",
    "result_schema_id": "result.pfki.scenario-plan.v1",
    "template_id": "template.pfki.scenario-plan.v1",
    "criteria_pack_id": "criteria.pfki.scenario-plan.v1",
    "example_pack_id": "example.pfki.scenario-plan.v1",
    "faq_pack_id": "faq.pfki.scenario-plan.v1",
    "source_policy_id": "sources.pfki.scenario-plan.v1",
    "profile_version": "1.0.0"
  },
  {
    "module_slug": "check-application",
    "contest_slug": "pfki",
    "status": "preparing",
    "card_visibility": "visible",
    "form_schema_id": null,
    "prompt_pack_id": null,
    "result_schema_id": null,
    "template_id": null,
    "criteria_pack_id": null,
    "example_pack_id": null,
    "faq_pack_id": null,
    "source_policy_id": null,
    "profile_version": null
  },
  {
    "module_slug": "social-research",
    "contest_slug": "fpg",
    "status": "preparing",
    "card_visibility": "visible",
    "form_schema_id": null,
    "prompt_pack_id": null,
    "result_schema_id": null,
    "template_id": null,
    "criteria_pack_id": null,
    "example_pack_id": null,
    "faq_pack_id": null,
    "source_policy_id": null,
    "profile_version": null
  },
  {
    "module_slug": "legal-acts",
    "contest_slug": "fpg",
    "status": "preparing",
    "card_visibility": "visible",
    "form_schema_id": null,
    "prompt_pack_id": null,
    "result_schema_id": null,
    "template_id": null,
    "criteria_pack_id": null,
    "example_pack_id": null,
    "faq_pack_id": null,
    "source_policy_id": null,
    "profile_version": null
  },
  {
    "module_slug": "salary",
    "contest_slug": "fpg",
    "status": "preparing",
    "card_visibility": "visible",
    "form_schema_id": null,
    "prompt_pack_id": null,
    "result_schema_id": null,
    "template_id": null,
    "criteria_pack_id": null,
    "example_pack_id": null,
    "faq_pack_id": null,
    "source_policy_id": null,
    "profile_version": null
  },
  {
    "module_slug": "support-letter",
    "contest_slug": "fpg",
    "status": "preparing",
    "card_visibility": "visible",
    "form_schema_id": null,
    "prompt_pack_id": null,
    "result_schema_id": null,
    "template_id": null,
    "criteria_pack_id": null,
    "example_pack_id": null,
    "faq_pack_id": null,
    "source_policy_id": null,
    "profile_version": null
  },
  {
    "module_slug": "presentation",
    "contest_slug": "fpg",
    "status": "preparing",
    "card_visibility": "visible",
    "form_schema_id": null,
    "prompt_pack_id": null,
    "result_schema_id": null,
    "template_id": null,
    "criteria_pack_id": null,
    "example_pack_id": null,
    "faq_pack_id": null,
    "source_policy_id": null,
    "profile_version": null
  },
  {
    "module_slug": "scenario-plan",
    "contest_slug": "fpg",
    "status": "preparing",
    "card_visibility": "visible",
    "form_schema_id": null,
    "prompt_pack_id": null,
    "result_schema_id": null,
    "template_id": null,
    "criteria_pack_id": null,
    "example_pack_id": null,
    "faq_pack_id": null,
    "source_policy_id": null,
    "profile_version": null
  },
  {
    "module_slug": "check-application",
    "contest_slug": "fpg",
    "status": "preparing",
    "card_visibility": "visible",
    "form_schema_id": null,
    "prompt_pack_id": null,
    "result_schema_id": null,
    "template_id": null,
    "criteria_pack_id": null,
    "example_pack_id": null,
    "faq_pack_id": null,
    "source_policy_id": null,
    "profile_version": null
  },
  {
    "module_slug": "social-research",
    "contest_slug": "rosmolodezh",
    "status": "preparing",
    "card_visibility": "visible",
    "form_schema_id": null,
    "prompt_pack_id": null,
    "result_schema_id": null,
    "template_id": null,
    "criteria_pack_id": null,
    "example_pack_id": null,
    "faq_pack_id": null,
    "source_policy_id": null,
    "profile_version": null
  },
  {
    "module_slug": "legal-acts",
    "contest_slug": "rosmolodezh",
    "status": "preparing",
    "card_visibility": "visible",
    "form_schema_id": null,
    "prompt_pack_id": null,
    "result_schema_id": null,
    "template_id": null,
    "criteria_pack_id": null,
    "example_pack_id": null,
    "faq_pack_id": null,
    "source_policy_id": null,
    "profile_version": null
  },
  {
    "module_slug": "salary",
    "contest_slug": "rosmolodezh",
    "status": "preparing",
    "card_visibility": "visible",
    "form_schema_id": null,
    "prompt_pack_id": null,
    "result_schema_id": null,
    "template_id": null,
    "criteria_pack_id": null,
    "example_pack_id": null,
    "faq_pack_id": null,
    "source_policy_id": null,
    "profile_version": null
  },
  {
    "module_slug": "support-letter",
    "contest_slug": "rosmolodezh",
    "status": "preparing",
    "card_visibility": "visible",
    "form_schema_id": null,
    "prompt_pack_id": null,
    "result_schema_id": null,
    "template_id": null,
    "criteria_pack_id": null,
    "example_pack_id": null,
    "faq_pack_id": null,
    "source_policy_id": null,
    "profile_version": null
  },
  {
    "module_slug": "presentation",
    "contest_slug": "rosmolodezh",
    "status": "preparing",
    "card_visibility": "visible",
    "form_schema_id": null,
    "prompt_pack_id": null,
    "result_schema_id": null,
    "template_id": null,
    "criteria_pack_id": null,
    "example_pack_id": null,
    "faq_pack_id": null,
    "source_policy_id": null,
    "profile_version": null
  },
  {
    "module_slug": "scenario-plan",
    "contest_slug": "rosmolodezh",
    "status": "preparing",
    "card_visibility": "visible",
    "form_schema_id": null,
    "prompt_pack_id": null,
    "result_schema_id": null,
    "template_id": null,
    "criteria_pack_id": null,
    "example_pack_id": null,
    "faq_pack_id": null,
    "source_policy_id": null,
    "profile_version": null
  },
  {
    "module_slug": "check-application",
    "contest_slug": "rosmolodezh",
    "status": "preparing",
    "card_visibility": "visible",
    "form_schema_id": null,
    "prompt_pack_id": null,
    "result_schema_id": null,
    "template_id": null,
    "criteria_pack_id": null,
    "example_pack_id": null,
    "faq_pack_id": null,
    "source_policy_id": null,
    "profile_version": null
  },
  {
    "module_slug": "social-research",
    "contest_slug": "first_grants",
    "status": "preparing",
    "card_visibility": "visible",
    "form_schema_id": null,
    "prompt_pack_id": null,
    "result_schema_id": null,
    "template_id": null,
    "criteria_pack_id": null,
    "example_pack_id": null,
    "faq_pack_id": null,
    "source_policy_id": null,
    "profile_version": null
  },
  {
    "module_slug": "legal-acts",
    "contest_slug": "first_grants",
    "status": "preparing",
    "card_visibility": "visible",
    "form_schema_id": null,
    "prompt_pack_id": null,
    "result_schema_id": null,
    "template_id": null,